{
  "claim_scope": "registered dataset execution or synthetic validation; manuscript agreement requires result artifact bindings",
  "config_sha256": "286b22b6af7a6faefa617db030931ef522bef77157294b536089634410ea53da",
  "created_utc": "2026-10-25T19:05:29.210007+00:00",
  "dataset": "synthetic",
  "evaluator": null,
  "inputs": [],
  "model_audit": null,
  "outputs": [
    {
      "bytes": 1815,
      "path": "action_registry.json",
      "sha256": "6dda7a004f82a77c140474da0a3a2bb58e533149e3c5806bf2eaad131b104cad"
    },
    {
      "bytes": 2933,
      "path": "config.json",
      "sha256": "eadc4d0666c2f32cd4bdf6c6dc38ed28b6b715d0538131674b0167e7dc76fb3d"
    },
    {
      "bytes": 3485,
      "path": "environment.json",
      "sha256": "0c9fd228c221ad336877ef58d981b3ddbb816bf246b266887cbb2b6d95c7d902"
    },
    {
      "bytes": 0,
      "path": "prepared/.prepare.lock",
      "sha256": "e3b0c44298fc1c149afbf4c8996fb92427ae41e4649b934ca495991b7852b855"
    },
    {
      "bytes": 916,
      "path": "prepared/clusters.npz",
      "sha256": "babedb0595c27168ed8813c9b9d0b2d456a119b878907ed37091ad251fe5b6df"
    },
    {
      "bytes": 76000,
      "path": "prepared/graph.npz",
      "sha256": "e94969b8753e50e25568bdcafdfee6c65648383dea06a6223e03a092b46e6083"
    },
    {
      "bytes": 2838,
      "path": "prepared/graph_splits.npz",
      "sha256": "921f7a501d28cfdcbe38e7a08af9574c8492406aeb0e5c6652d2f47bfeb54f3e"
    },
    {
      "bytes": 12115,
      "path": "prepared/metadata.json",
      "sha256": "50735b76750a7b4fad52b51c59921620a401976d11d6dfe48cb15adb6feddfc0"
    },
    {
      "bytes": 1386,
      "path": "prepared/official_splits.npz",
      "sha256": "5db94f5ea4d43b99d136d0e7372b9e67525d00c1cad25124dfb6c434e54f0198"
    },
    {
      "bytes": 2838,
      "path": "prepared/splits.npz",
      "sha256": "921f7a501d28cfdcbe38e7a08af9574c8492406aeb0e5c6652d2f47bfeb54f3e"
    },
    {
      "bytes": 55443,
      "path": "provenance/evaluator.py",
      "sha256": "1adaf12cfd31c68c4207f7796063eb5856353bfe63be43b91ee6fdff8e452050"
    }
  ],
  "parent_manifest": null,
  "schema_version": "1.1",
  "scientific_role": "auxiliary",
  "source_sha256": "9e0154c11c0ebc67d533a84b6d6a80c4e77a8d76e6d2cc165bcff5897980b108",
  "stage": "prepare",
  "stage_index": 0,
  "unit_manifest_path": "prepared/splits.npz",
  "unit_sha256": "921f7a501d28cfdcbe38e7a08af9574c8492406aeb0e5c6652d2f47bfeb54f3e"
}
